{"$id":"https://model-benchmark.invalid/schemas/scenario-lock-v1.schema.json","$schema":"https://json-schema.org/draft/2020-12/schema","additionalProperties":false,"properties":{"harbor":{"additionalProperties":false,"properties":{"commit":{"const":"527d50deb63a5d279e8c20593c18a2cbc7f61f9e"},"task_content_sha256":{"pattern":"^harbor-task:sha256:[0-9a-f]{64}$","type":"string"}},"required":["commit","task_content_sha256"],"type":"object"},"identities":{"additionalProperties":false,"properties":{"scenario":{"additionalProperties":false,"properties":{"digest":{"pattern":"^scenario:sha256:[0-9a-f]{64}$","type":"string"},"kind":{"const":"scenario"},"version":{"pattern":"^(0|[1-9][0-9]*)\\.(0|[1-9][0-9]*)\\.(0|[1-9][0-9]*)(?:-[0-9A-Za-z-]+(?:\\.[0-9A-Za-z-]+)*)?(?:\\+[0-9A-Za-z-]+(?:\\.[0-9A-Za-z-]+)*)?$","type":"string"}},"required":["digest","kind","version"],"type":"object"},"score_contract":{"additionalProperties":false,"properties":{"digest":{"pattern":"^score-contract:sha256:[0-9a-f]{64}$","type":"string"},"kind":{"const":"score-contract"},"version":{"pattern":"^(0|[1-9][0-9]*)\\.(0|[1-9][0-9]*)\\.(0|[1-9][0-9]*)(?:-[0-9A-Za-z-]+(?:\\.[0-9A-Za-z-]+)*)?(?:\\+[0-9A-Za-z-]+(?:\\.[0-9A-Za-z-]+)*)?$","type":"string"}},"required":["digest","kind","version"],"type":"object"},"verifier":{"additionalProperties":false,"properties":{"digest":{"pattern":"^verifier:sha256:[0-9a-f]{64}$","type":"string"},"kind":{"const":"verifier"},"version":{"pattern":"^(0|[1-9][0-9]*)\\.(0|[1-9][0-9]*)\\.(0|[1-9][0-9]*)(?:-[0-9A-Za-z-]+(?:\\.[0-9A-Za-z-]+)*)?(?:\\+[0-9A-Za-z-]+(?:\\.[0-9A-Za-z-]+)*)?$","type":"string"}},"required":["digest","kind","version"],"type":"object"}},"required":["scenario","score_contract","verifier"],"type":"object"},"package":{"additionalProperties":false,"properties":{"files":{"items":{"additionalProperties":false,"properties":{"agent_visible":{"type":"boolean"},"bytes":{"minimum":0,"type":"integer"},"mode":{"enum":["0644","0755"]},"path":{"minLength":1,"type":"string"},"role":{"enum":["agent-image-input","agent-resource","author-only","developer-brief","harbor-task","project-declaration","trusted-provisioning","trusted-submission-capture","verifier-only","verifier-resource"]},"sha256":{"pattern":"^artifact:sha256:[0-9a-f]{64}$","type":"string"}},"required":["agent_visible","bytes","path","role","sha256","mode"],"type":"object"},"minItems":6,"type":"array"},"payload_sha256":{"pattern":"^package-payload:sha256:[0-9a-f]{64}$","type":"string"}},"required":["files","payload_sha256"],"type":"object"},"resolved_inputs":{"additionalProperties":false,"properties":{"datasets":{"items":{"additionalProperties":false,"properties":{"id":{"minLength":1,"type":"string"},"path":{"minLength":1,"type":"string"},"sha256":{"pattern":"^artifact:sha256:[0-9a-f]{64}$","type":"string"},"visibility":{"enum":["agent","verifier"]}},"required":["id","path","sha256","visibility"],"type":"object"},"type":"array"},"images":{"items":{"additionalProperties":false,"properties":{"identity":{"pattern":"^oci-image:sha256:[0-9a-f]{64}$","type":"string"},"reference":{"pattern":"^[^\\s@]+@sha256:[0-9a-f]{64}$","type":"string"}},"required":["identity","reference"],"type":"object"},"minItems":1,"type":"array"},"pristine":{"additionalProperties":false,"properties":{"archive":{"oneOf":[{"type":"null"},{"minLength":1,"type":"string"}]},"archive_sha256":{"oneOf":[{"type":"null"},{"pattern":"^artifact:sha256:[0-9a-f]{64}$","type":"string"}]},"commit":{"pattern":"^(?:[0-9a-f]{40}|[0-9a-f]{64})$","type":"string"},"license":{"minLength":1,"type":"string"},"origin":{"minLength":1,"type":"string"},"tree_sha256":{"pattern":"^source-tree:sha256:[0-9a-f]{64}$","type":"string"}},"required":["archive","archive_sha256","commit","license","origin","tree_sha256"],"type":"object"},"scenario_baseline":{"pattern":"^source-tree:sha256:[0-9a-f]{64}$","type":"string"},"seed_inputs":{"items":{"oneOf":[{"additionalProperties":false,"properties":{"kind":{"const":"git-patch"},"path":{"minLength":1,"type":"string"},"sha256":{"pattern":"^artifact:sha256:[0-9a-f]{64}$","type":"string"}},"required":["kind","path","sha256"],"type":"object"},{"additionalProperties":false,"properties":{"destination":{"minLength":1,"type":"string"},"kind":{"const":"asset"},"path":{"minLength":1,"type":"string"},"sha256":{"pattern":"^artifact:sha256:[0-9a-f]{64}$","type":"string"}},"required":["destination","kind","path","sha256"],"type":"object"}]},"type":"array"}},"required":["datasets","images","pristine","scenario_baseline","seed_inputs"],"type":"object"},"scenario_id":{"pattern":"^[a-z0-9][a-z0-9._-]*/[a-z0-9][a-z0-9._-]*$","type":"string"},"schema":{"additionalProperties":false,"properties":{"canonicalization_sha256":{"pattern":"^canonicalization:sha256:[0-9a-f]{64}$","type":"string"},"canonicalization_version":{"const":1},"name":{"minLength":1,"type":"string"},"sha256":{"pattern":"^schema:sha256:[0-9a-f]{64}$","type":"string"},"version":{"const":1}},"required":["canonicalization_sha256","canonicalization_version","name","sha256","version"],"type":"object"},"standard_v1":{"additionalProperties":false,"properties":{"id":{"const":"standard-v1"},"sha256":{"pattern":"^execution-profile:sha256:[0-9a-f]{64}$","type":"string"}},"required":["id","sha256"],"type":"object"}},"required":["harbor","identities","package","resolved_inputs","scenario_id","schema","standard_v1"],"type":"object","x-model-benchmark-schema-name":"model-benchmark/scenario-lock","x-model-benchmark-schema-version":1}