{"harbor":{"commit":"527d50deb63a5d279e8c20593c18a2cbc7f61f9e","task_content_sha256":"harbor-task:sha256:92a35f55216ad6aac84f70149f1a5bee7dd8d89e06c46d12abd6a932d9200328"},"identities":{"scenario":{"digest":"scenario:sha256:ee60417ab906cbfe16ef2810e19880e5637bf568426f46ea93483cb4fdb992b9","kind":"scenario","version":"1.0.0"},"score_contract":{"digest":"score-contract:sha256:87b3455c211e61aa65f943c9a8b73e2e2645c69a7e0d8167ce828362231babef","kind":"score-contract","version":"1.0.0"},"verifier":{"digest":"verifier:sha256:9aa229ef55f47f49f7ff7584d114b9977958a3cc821216649b641ec33abcfcc0","kind":"verifier","version":"1.0.0"}},"package":{"files":[{"agent_visible":true,"bytes":874,"mode":"0644","path":"data/sales-agent.json","role":"agent-resource","sha256":"artifact:sha256:8b04004deae4a0d0ba943227dcbd9fa4ff5330f7db776fff337c811901e42363"},{"agent_visible":false,"bytes":996,"mode":"0644","path":"data/sales-hidden-a.json","role":"verifier-resource","sha256":"artifact:sha256:21481f802a478b978ce3eaa924687c015936f7157857eeeb0a9ca576cd15ee90"},{"agent_visible":false,"bytes":780,"mode":"0644","path":"data/sales-hidden-b.json","role":"verifier-resource","sha256":"artifact:sha256:84ec52d269c782c4ba62aad324b19a6a19cbc5e915fa9d2fb896bf9470c0908d"},{"agent_visible":true,"bytes":368,"mode":"0644","path":"environment/Dockerfile","role":"agent-image-input","sha256":"artifact:sha256:796054df708890f37debb79c105bfd631759736935cfd5c3cf520834452da441"},{"agent_visible":true,"bytes":110,"mode":"0644","path":"environment/baseline/README.md","role":"agent-image-input","sha256":"artifact:sha256:3b40ae06f3711dd4f1ec91e65c23750e965658aef7718102edba20d843e5b112"},{"agent_visible":true,"bytes":874,"mode":"0644","path":"environment/baseline/data/sales.json","role":"agent-image-input","sha256":"artifact:sha256:8b04004deae4a0d0ba943227dcbd9fa4ff5330f7db776fff337c811901e42363"},{"agent_visible":true,"bytes":2280,"mode":"0644","path":"environment/baseline/sales_by_genre.py","role":"agent-image-input","sha256":"artifact:sha256:7c20837705b00627e72125ce428db4e3d0159bdc55c1d7ee67abdc6b17b9c3a0"},{"agent_visible":false,"bytes":335,"mode":"0644","path":"environment/capture/Dockerfile","role":"trusted-submission-capture","sha256":"artifact:sha256:e0fdf4c465d6b34bffeb3c59b8353826b51b600fe36162420e31a37d11089af6"},{"agent_visible":false,"bytes":15923,"mode":"0644","path":"environment/capture/capture.py","role":"trusted-submission-capture","sha256":"artifact:sha256:32b368ce4eb31e274995462753aa8947e6fa6f67947f7fd12b7cebe964de4435"},{"agent_visible":false,"bytes":271,"mode":"0644","path":"environment/capture/policy.json","role":"trusted-submission-capture","sha256":"artifact:sha256:ed3a9d49a96af5b8ee4a345b32cba78046ffa3732e9200d5c0642f52c7ca3737"},{"agent_visible":true,"bytes":797,"mode":"0644","path":"environment/docker-compose.yaml","role":"agent-image-input","sha256":"artifact:sha256:23eeabb70710ec592e7a9b938b0851dec8adcd32c8bfb1df6d4e47b9bee8464a"},{"agent_visible":true,"bytes":537,"mode":"0644","path":"instruction.md","role":"developer-brief","sha256":"artifact:sha256:835e1448f4849dc14a3ca44e9c2c1bd8ed5dcc9e9ffc239b5687c6dcc2327392"},{"agent_visible":false,"bytes":3740,"mode":"0644","path":"scenario.yaml","role":"project-declaration","sha256":"artifact:sha256:86033cf07e132a735b4736f6060466a536802c8aba45d790b9b4236fa4bf0fbb"},{"agent_visible":false,"bytes":559,"mode":"0644","path":"seed/defect.patch","role":"trusted-provisioning","sha256":"artifact:sha256:93d53e6dea54b71245812df1b8c5bd7f057ae2c34a9d9a934c849003bdf95d9e"},{"agent_visible":false,"bytes":2308,"mode":"0755","path":"seed/generate_sales_data.py","role":"trusted-provisioning","sha256":"artifact:sha256:d70ce087b3e07dd9a1c28444f1bee8b6bd1c91aadd37d0194c4e32cdcc8aec50"},{"agent_visible":false,"bytes":10240,"mode":"0644","path":"seed/pristine.tar","role":"trusted-provisioning","sha256":"artifact:sha256:2589eee4e692b79803bff530d5ad496985ad5d9969e28b19ac0b1568c143e2b1"},{"agent_visible":false,"bytes":874,"mode":"0644","path":"seed/sales-agent.json","role":"trusted-provisioning","sha256":"artifact:sha256:8b04004deae4a0d0ba943227dcbd9fa4ff5330f7db776fff337c811901e42363"},{"agent_visible":false,"bytes":423,"mode":"0755","path":"solution/solve.py","role":"author-only","sha256":"artifact:sha256:021db382750c2e243f63de8b2e2fc7b591a70dc19c99218c12bafb530b2c7a16"},{"agent_visible":false,"bytes":109,"mode":"0755","path":"solution/solve.sh","role":"author-only","sha256":"artifact:sha256:5001bf815ca5443e58f836af2abfa3eed8add694bf8adb7f116cf627158d5545"},{"agent_visible":false,"bytes":880,"mode":"0644","path":"task.toml","role":"harbor-task","sha256":"artifact:sha256:69819a468a7db6fade9fe36eae7755482a1d645e0d709de44958ca28c653890f"},{"agent_visible":false,"bytes":251,"mode":"0644","path":"tests/Dockerfile","role":"verifier-only","sha256":"artifact:sha256:c3ef5de7c874a5d94efe879a0119dba369597f10a176ad845371854efc16471c"},{"agent_visible":false,"bytes":1979,"mode":"0755","path":"tests/apply_patch.py","role":"verifier-only","sha256":"artifact:sha256:cb0be15d14589e18f5049040acd99c38483432786190fd74b209afc6f3f47866"},{"agent_visible":false,"bytes":10240,"mode":"0644","path":"tests/baseline.tar","role":"verifier-only","sha256":"artifact:sha256:91495f58cef169def415ba6aab23179503a6057ee3b2e8a3b0daf214bf5beebc"},{"agent_visible":false,"bytes":996,"mode":"0644","path":"tests/data/sales-hidden-a.json","role":"verifier-only","sha256":"artifact:sha256:21481f802a478b978ce3eaa924687c015936f7157857eeeb0a9ca576cd15ee90"},{"agent_visible":false,"bytes":780,"mode":"0644","path":"tests/data/sales-hidden-b.json","role":"verifier-only","sha256":"artifact:sha256:84ec52d269c782c4ba62aad324b19a6a19cbc5e915fa9d2fb896bf9470c0908d"},{"agent_visible":false,"bytes":60,"mode":"0644","path":"tests/private-canary.txt","role":"verifier-only","sha256":"artifact:sha256:a90c19e68e65a6174192c31dd2876c77c2cf9c01c02bb9c5edcdec3e8871c004"},{"agent_visible":false,"bytes":365,"mode":"0755","path":"tests/test.sh","role":"verifier-only","sha256":"artifact:sha256:5faf4956a97f4ad0e5651c0a985c3b0d50a5a88d11ef9a2735632d902267d50d"},{"agent_visible":false,"bytes":4509,"mode":"0755","path":"tests/verify.py","role":"verifier-only","sha256":"artifact:sha256:1c276d655e245aee75245ac96f998f12b9fdd01bf269dc6926393fbd159fc162"}],"payload_sha256":"package-payload:sha256:f956f7a3434697ff74d1399e7cfe6ed55442b2a2c2acad6eabbef3b0d85211db"},"resolved_inputs":{"datasets":[{"id":"sales-agent-v1","path":"data/sales-agent.json","sha256":"artifact:sha256:8b04004deae4a0d0ba943227dcbd9fa4ff5330f7db776fff337c811901e42363","visibility":"agent"},{"id":"sales-hidden-a-v1","path":"data/sales-hidden-a.json","sha256":"artifact:sha256:21481f802a478b978ce3eaa924687c015936f7157857eeeb0a9ca576cd15ee90","visibility":"verifier"},{"id":"sales-hidden-b-v1","path":"data/sales-hidden-b.json","sha256":"artifact:sha256:84ec52d269c782c4ba62aad324b19a6a19cbc5e915fa9d2fb896bf9470c0908d","visibility":"verifier"}],"images":[{"identity":"oci-image:sha256:593bd06efe90efa80dc4eee3948be7c0fde4134606dd40d8dd8dbcade98e669c","reference":"python:3.12.12-slim-bookworm@sha256:593bd06efe90efa80dc4eee3948be7c0fde4134606dd40d8dd8dbcade98e669c"}],"pristine":{"archive":"seed/pristine.tar","archive_sha256":"artifact:sha256:2589eee4e692b79803bff530d5ad496985ad5d9969e28b19ac0b1568c143e2b1","commit":"d70ce087b3e07dd9a1c28444f1bee8b6bd1c91aadd37d0194c4e32cdcc8aec50","license":"NOASSERTION","origin":"urn:model-benchmark:generated:python-sales-by-genre-v1","tree_sha256":"source-tree:sha256:3941a5fa5320f197de14e98dedbae23841be22cb230414f2206e4676e4f1a318"},"scenario_baseline":"source-tree:sha256:15cba8c8b5a8a1907923e7feda9b9d6ec75b3b47a9d040939f2a09b085aad151","seed_inputs":[{"kind":"git-patch","path":"seed/defect.patch","sha256":"artifact:sha256:93d53e6dea54b71245812df1b8c5bd7f057ae2c34a9d9a934c849003bdf95d9e"},{"destination":"data/sales.json","kind":"asset","path":"seed/sales-agent.json","sha256":"artifact:sha256:8b04004deae4a0d0ba943227dcbd9fa4ff5330f7db776fff337c811901e42363"}]},"scenario_id":"functional-v1/python-sales-by-genre","schema":{"canonicalization_sha256":"canonicalization:sha256:5f871a41f05d8bab1af662a5c91cce456c05af84c77f602d0572da778ec5f3f9","canonicalization_version":1,"name":"model-benchmark/scenario-lock","sha256":"schema:sha256:73f848d0474eaa16b58fe0be10c8d44fa658a24767bf20ce4f42b151ec127896","version":1},"standard_v1":{"id":"standard-v1","sha256":"execution-profile:sha256:3c8c18d9509ad733fd79ba6c98b3350571767c1b9b5817f3302804727f2d5c22"}}