{"harbor":{"commit":"527d50deb63a5d279e8c20593c18a2cbc7f61f9e","task_content_sha256":"harbor-task:sha256:85b9226d0c221476367106447f2586626b8f1fd391f670bd9f7be12db0efb88a"},"identities":{"scenario":{"digest":"scenario:sha256:874ce5a4b35f3102e716d26d7485213c18833f94d3f2e3de837faabff394ee6d","kind":"scenario","version":"1.0.0"},"score_contract":{"digest":"score-contract:sha256:ade9d2b3ed0dc2bef22f8f83a02773405816980f33de7e2189a22dea5146ce00","kind":"score-contract","version":"1.0.0"},"verifier":{"digest":"verifier:sha256:5ff802654d75470c0bcd9e98afd66709aa18025e556909f4f720d31814775119","kind":"verifier","version":"1.0.0"}},"package":{"files":[{"agent_visible":true,"bytes":375,"mode":"0644","path":"environment/Dockerfile","role":"agent-image-input","sha256":"artifact:sha256:926dedad333fdc9bed5fa32b50cc6479fd78a819415df44d6909dd3955288444"},{"agent_visible":true,"bytes":10534,"mode":"0644","path":"environment/baseline/README.md","role":"agent-image-input","sha256":"artifact:sha256:6d837738cd3960131fdbc2adf2e1916deffe83fb92390f533710f1c3938b1ea2"},{"agent_visible":true,"bytes":1344,"mode":"0644","path":"environment/baseline/src/main/java/org/springframework/samples/petclinic/model/BaseEntity.java","role":"agent-image-input","sha256":"artifact:sha256:2c8f47a328f8bc4ad0ed887890dcf731469ec8f1032b5420d173c7aa5a352600"},{"agent_visible":true,"bytes":1367,"mode":"0644","path":"environment/baseline/src/main/java/org/springframework/samples/petclinic/model/NamedEntity.java","role":"agent-image-input","sha256":"artifact:sha256:6695dafa9b8d4cc67c0cf9305b17b897c58103ca33c12dd0f9375edcfe815b32"},{"agent_visible":true,"bytes":2186,"mode":"0644","path":"environment/baseline/src/main/java/org/springframework/samples/petclinic/owner/Pet.java","role":"agent-image-input","sha256":"artifact:sha256:ec77c2d70ae043c6eb441e47ebc93a3d848d8ae9729068e8f4e997aedfa0bbd7"},{"agent_visible":true,"bytes":951,"mode":"0644","path":"environment/baseline/src/main/java/org/springframework/samples/petclinic/owner/PetType.java","role":"agent-image-input","sha256":"artifact:sha256:9e64329633ce98a96f18cecf7426338d57b753fd24b7b47f7af483467a3df92e"},{"agent_visible":true,"bytes":1809,"mode":"0644","path":"environment/baseline/src/main/java/org/springframework/samples/petclinic/owner/PetValidator.java","role":"agent-image-input","sha256":"artifact:sha256:9ce8488be76ded2e9b8dbe6846a90e43f55d4b6ee20bdbd27d79a2c91328610d"},{"agent_visible":false,"bytes":335,"mode":"0644","path":"environment/capture/Dockerfile","role":"trusted-submission-capture","sha256":"artifact:sha256:e0fdf4c465d6b34bffeb3c59b8353826b51b600fe36162420e31a37d11089af6"},{"agent_visible":false,"bytes":15923,"mode":"0644","path":"environment/capture/capture.py","role":"trusted-submission-capture","sha256":"artifact:sha256:32b368ce4eb31e274995462753aa8947e6fa6f67947f7fd12b7cebe964de4435"},{"agent_visible":false,"bytes":329,"mode":"0644","path":"environment/capture/policy.json","role":"trusted-submission-capture","sha256":"artifact:sha256:50428699b42050832a4570eb993d3d7e4fb76b6e7a1c7e82113a6461a516102d"},{"agent_visible":true,"bytes":797,"mode":"0644","path":"environment/docker-compose.yaml","role":"agent-image-input","sha256":"artifact:sha256:23eeabb70710ec592e7a9b938b0851dec8adcd32c8bfb1df6d4e47b9bee8464a"},{"agent_visible":true,"bytes":512,"mode":"0644","path":"instruction.md","role":"developer-brief","sha256":"artifact:sha256:c7fd19aeaae34ae7adb6105731dd5aaddd549a4d253c56c66dd4418e8acf868f"},{"agent_visible":false,"bytes":3173,"mode":"0644","path":"scenario.yaml","role":"project-declaration","sha256":"artifact:sha256:cb88b4ceeb98a1671c648df45359450e98eabae4f6393280b6fde967719ffc55"},{"agent_visible":false,"bytes":611,"mode":"0644","path":"seed/defect.patch","role":"trusted-provisioning","sha256":"artifact:sha256:0147e692d1ee4776c07cf9a60f73a7baa248f9bf1b6207a558b2b744454f4a1f"},{"agent_visible":false,"bytes":30720,"mode":"0644","path":"seed/pristine.tar","role":"trusted-provisioning","sha256":"artifact:sha256:5ab5af2ba00b6016ce707089f588596fd312eba481d798933750e5cfb533fc21"},{"agent_visible":false,"bytes":334,"mode":"0755","path":"solution/solve.sh","role":"author-only","sha256":"artifact:sha256:6e110640db10845c6c94efc74ab405d9881392deddc163fe9db9bb9e3334e6cb"},{"agent_visible":false,"bytes":892,"mode":"0644","path":"task.toml","role":"harbor-task","sha256":"artifact:sha256:c117b1a582b60d6c774bbb9c6834640bc7f448ad8f646c4f7db2088f5b12ae22"},{"agent_visible":false,"bytes":246,"mode":"0644","path":"tests/Dockerfile","role":"verifier-only","sha256":"artifact:sha256:131fd81abe5055730e4a53d2575f824eff930ed8eb855e540f059fe21a9de86c"},{"agent_visible":false,"bytes":30720,"mode":"0644","path":"tests/baseline.tar","role":"verifier-only","sha256":"artifact:sha256:b4b39bfac7acbba14dfbc0d58512a3b37ca5b172ce9b3cd722e995520bdd176f"},{"agent_visible":false,"bytes":597,"mode":"0644","path":"tests/java/org/springframework/samples/petclinic/owner/Pet.java","role":"verifier-only","sha256":"artifact:sha256:1cf48ce9287ae43f8f1483ce8e8f31a67a9d8b18af32b238ddf56e3180f41e6f"},{"agent_visible":false,"bytes":2218,"mode":"0644","path":"tests/java/org/springframework/samples/petclinic/owner/PetValidatorBehavior.java","role":"verifier-only","sha256":"artifact:sha256:97ff7db60058012f365dff47e17201170be0e01824f9ef6b48a06ec5a3b86b5a"},{"agent_visible":false,"bytes":448,"mode":"0644","path":"tests/java/org/springframework/util/StringUtils.java","role":"verifier-only","sha256":"artifact:sha256:aa03053661256f2ab00531de6345989b486220aa96374a1e1657326ea82444b1"},{"agent_visible":false,"bytes":138,"mode":"0644","path":"tests/java/org/springframework/validation/Errors.java","role":"verifier-only","sha256":"artifact:sha256:94ca09398af45d96e19673e6603548fe8f53e247b713e604301280f6d8720ccb"},{"agent_visible":false,"bytes":154,"mode":"0644","path":"tests/java/org/springframework/validation/Validator.java","role":"verifier-only","sha256":"artifact:sha256:47c524154d67a2e6ab411b944ee7c77419f64a381fb2c2c67459cc46e3fedd6a"},{"agent_visible":false,"bytes":60,"mode":"0644","path":"tests/private-canary.txt","role":"verifier-only","sha256":"artifact:sha256:a90c19e68e65a6174192c31dd2876c77c2cf9c01c02bb9c5edcdec3e8871c004"},{"agent_visible":false,"bytes":2404,"mode":"0755","path":"tests/test.sh","role":"verifier-only","sha256":"artifact:sha256:d56f499f510b5c2154f4d627a1ae0674cac826da568fb5b67c9b1f5b9219daa6"}],"payload_sha256":"package-payload:sha256:374cc4f70f3de61773af809736a85aa93fff09c2d49893f3865b5b4730de68f6"},"resolved_inputs":{"datasets":[],"images":[{"identity":"oci-image:sha256:6fdc855a6ed81d288ca7ca37ac6ff5e9308b612485c0801d70b25a858c83d237","reference":"maven:3.9.11-eclipse-temurin-21@sha256:6fdc855a6ed81d288ca7ca37ac6ff5e9308b612485c0801d70b25a858c83d237"},{"identity":"oci-image:sha256:593bd06efe90efa80dc4eee3948be7c0fde4134606dd40d8dd8dbcade98e669c","reference":"python:3.12.12-slim-bookworm@sha256:593bd06efe90efa80dc4eee3948be7c0fde4134606dd40d8dd8dbcade98e669c"}],"pristine":{"archive":"seed/pristine.tar","archive_sha256":"artifact:sha256:5ab5af2ba00b6016ce707089f588596fd312eba481d798933750e5cfb533fc21","commit":"b3ee2c53e76e9267f03551a7cd36b0983c859c56","license":"Apache-2.0","origin":"https://github.com/spring-projects/spring-petclinic","tree_sha256":"source-tree:sha256:c9ec11da9790dcc7e4c4a34ece3030f921c50984cf7cf2f742524d617e528678"},"scenario_baseline":"source-tree:sha256:f39cd06d1ccb0c2c4edcbeda2f9f22356f74301effcad826dc346c888cd2913a","seed_inputs":[{"kind":"git-patch","path":"seed/defect.patch","sha256":"artifact:sha256:0147e692d1ee4776c07cf9a60f73a7baa248f9bf1b6207a558b2b744454f4a1f"}]},"scenario_id":"functional-v1/spring-petvalidator-whitespace","schema":{"canonicalization_sha256":"canonicalization:sha256:5f871a41f05d8bab1af662a5c91cce456c05af84c77f602d0572da778ec5f3f9","canonicalization_version":1,"name":"model-benchmark/scenario-lock","sha256":"schema:sha256:73f848d0474eaa16b58fe0be10c8d44fa658a24767bf20ce4f42b151ec127896","version":1},"standard_v1":{"id":"standard-v1","sha256":"execution-profile:sha256:3c8c18d9509ad733fd79ba6c98b3350571767c1b9b5817f3302804727f2d5c22"}}