{"harbor":{"commit":"527d50deb63a5d279e8c20593c18a2cbc7f61f9e","task_content_sha256":"harbor-task:sha256:9d3b769af6297e90516fc33a2886d1e5b849cea16d795928411bc5cb80de99ba"},"identities":{"scenario":{"digest":"scenario:sha256:753662fd709b745fc40aefb932c70daa0b9b1640079675013950eabc7a208687","kind":"scenario","version":"1.0.0"},"score_contract":{"digest":"score-contract:sha256:5f9eceeec7910efe140fe49eee9fe5ce71d96ead9d43ba78d3dc0ebfb9188aa6","kind":"score-contract","version":"1.0.0"},"verifier":{"digest":"verifier:sha256:265ae32e41ca9450c2d9f56e2177bfe1a1d2ae76e6a53d8c408afd729b58bcdf","kind":"verifier","version":"1.0.0"}},"package":{"files":[{"agent_visible":true,"bytes":357,"mode":"0644","path":"environment/Dockerfile","role":"agent-image-input","sha256":"artifact:sha256:868f2a633d369d1846d2c476192ded1b2a19dcd28553b19e3f6210572e395843"},{"agent_visible":true,"bytes":1380,"mode":"0644","path":"environment/baseline/LICENSE","role":"agent-image-input","sha256":"artifact:sha256:698f055a5fa6844294c29278d88cd6fd8394785d769fdf165ea0accae677e2ce"},{"agent_visible":true,"bytes":3306,"mode":"0644","path":"environment/baseline/README.md","role":"agent-image-input","sha256":"artifact:sha256:fcfb93ffc2e9f5b6165ec1e4a91947bb01590d3a74f8560cc00c625b4bb10dd9"},{"agent_visible":true,"bytes":1962,"mode":"0644","path":"environment/baseline/package.json","role":"agent-image-input","sha256":"artifact:sha256:d822151cf71979c3946bfcb50fc3a0f4860401fa749603c8189c9c55888e27c3"},{"agent_visible":true,"bytes":1011,"mode":"0644","path":"environment/baseline/src/app/features/article/components/article-meta.component.ts","role":"agent-image-input","sha256":"artifact:sha256:2f9600fb99b6a7d72d52c9d64460dcb2ff1e6353605e7c57bc3159c45b6cd499"},{"agent_visible":true,"bytes":1711,"mode":"0644","path":"environment/baseline/src/app/features/article/components/article-preview.component.ts","role":"agent-image-input","sha256":"artifact:sha256:17e0eab0a12d0c6042d20a7baede6858d96dcd800db4a2bb701544d80c531564"},{"agent_visible":true,"bytes":2099,"mode":"0644","path":"environment/baseline/src/app/features/article/components/favorite-button.component.ts","role":"agent-image-input","sha256":"artifact:sha256:61287b0659ea244306967c4fea19ec6b3e9c630fed621620e78684459dbf22d1"},{"agent_visible":true,"bytes":294,"mode":"0644","path":"environment/baseline/src/app/features/article/models/article.model.ts","role":"agent-image-input","sha256":"artifact:sha256:da0f28217770c19c29235627b35c96b2518368afbd6661d088d88f8a01c8e48a"},{"agent_visible":false,"bytes":335,"mode":"0644","path":"environment/capture/Dockerfile","role":"trusted-submission-capture","sha256":"artifact:sha256:e0fdf4c465d6b34bffeb3c59b8353826b51b600fe36162420e31a37d11089af6"},{"agent_visible":false,"bytes":15923,"mode":"0644","path":"environment/capture/capture.py","role":"trusted-submission-capture","sha256":"artifact:sha256:32b368ce4eb31e274995462753aa8947e6fa6f67947f7fd12b7cebe964de4435"},{"agent_visible":false,"bytes":318,"mode":"0644","path":"environment/capture/policy.json","role":"trusted-submission-capture","sha256":"artifact:sha256:2cac9b149c2323539122dc1e36692263886f7714814d90fc3fff75bd2993b499"},{"agent_visible":true,"bytes":797,"mode":"0644","path":"environment/docker-compose.yaml","role":"agent-image-input","sha256":"artifact:sha256:23eeabb70710ec592e7a9b938b0851dec8adcd32c8bfb1df6d4e47b9bee8464a"},{"agent_visible":true,"bytes":573,"mode":"0644","path":"instruction.md","role":"developer-brief","sha256":"artifact:sha256:a90d939899c57547a282f507876816299c9e4b374da9ffa77a6cb680e8189081"},{"agent_visible":false,"bytes":3183,"mode":"0644","path":"scenario.yaml","role":"project-declaration","sha256":"artifact:sha256:dc80809cef7460c4d62134a752bf64a4d7abcefa3a6f8a76c774eb0719556cc2"},{"agent_visible":false,"bytes":730,"mode":"0644","path":"seed/feature.patch","role":"trusted-provisioning","sha256":"artifact:sha256:9bbf8bd23a9f2f961cebaaec8903d8b7549636b02fcb3602512f83a5f6bfa69d"},{"agent_visible":false,"bytes":30720,"mode":"0644","path":"seed/pristine.tar","role":"trusted-provisioning","sha256":"artifact:sha256:be14f51d3acd4c702e302d4b40085e6e5bbb12680147df1f069002f8687b1926"},{"agent_visible":false,"bytes":623,"mode":"0755","path":"solution/solve.mjs","role":"author-only","sha256":"artifact:sha256:4714b08d96ed184af4d05c354702b1f462c64cc5765e69a7dea1b317c449c753"},{"agent_visible":false,"bytes":107,"mode":"0755","path":"solution/solve.sh","role":"author-only","sha256":"artifact:sha256:ff8bbb87bc3ade1a7bd9a0fa063c0869ef9430757eb513a5d639e1c99d15179a"},{"agent_visible":false,"bytes":862,"mode":"0644","path":"task.toml","role":"harbor-task","sha256":"artifact:sha256:afe58ecdfd2ed92acd6c23437f419add82a19d2350fe51474c563421975b69d5"},{"agent_visible":false,"bytes":253,"mode":"0644","path":"tests/Dockerfile","role":"verifier-only","sha256":"artifact:sha256:72fa06418dfc62f9ac588a611fe52573462f325e6ebc1ed642e3a138db934660"},{"agent_visible":false,"bytes":1509,"mode":"0755","path":"tests/apply-patch.mjs","role":"verifier-only","sha256":"artifact:sha256:28e60828bb4d911819744e19edf433ade2f460064104a7bcc42cc6496631866d"},{"agent_visible":false,"bytes":20480,"mode":"0644","path":"tests/baseline.tar","role":"verifier-only","sha256":"artifact:sha256:7d0e416152a1edd2019dac6a3dc49ada7f49964f3df66a357b3bf72ee9e3540d"},{"agent_visible":false,"bytes":60,"mode":"0644","path":"tests/private-canary.txt","role":"verifier-only","sha256":"artifact:sha256:a90c19e68e65a6174192c31dd2876c77c2cf9c01c02bb9c5edcdec3e8871c004"},{"agent_visible":false,"bytes":397,"mode":"0755","path":"tests/test.sh","role":"verifier-only","sha256":"artifact:sha256:e35a6dcfd07691255dead34ce7089e19197efa506927c9cc4b301a3f6fc912c9"},{"agent_visible":false,"bytes":3729,"mode":"0755","path":"tests/verify.mjs","role":"verifier-only","sha256":"artifact:sha256:ad74e2fcf7cd5b8f28976d1f16a1b1cfffa3ba1ff5904794f7b9256113e2d7b9"}],"payload_sha256":"package-payload:sha256:fd7b19f375453103cee6cda248f96a7e1a0acf9b24e67a19a16f3d9cbb792483"},"resolved_inputs":{"datasets":[],"images":[{"identity":"oci-image:sha256:b04ce4ae4e95b522112c2e5c52f781471a5cbc3b594527bcddedee9bc48c03a0","reference":"node:22.17.0-bookworm-slim@sha256:b04ce4ae4e95b522112c2e5c52f781471a5cbc3b594527bcddedee9bc48c03a0"},{"identity":"oci-image:sha256:593bd06efe90efa80dc4eee3948be7c0fde4134606dd40d8dd8dbcade98e669c","reference":"python:3.12.12-slim-bookworm@sha256:593bd06efe90efa80dc4eee3948be7c0fde4134606dd40d8dd8dbcade98e669c"}],"pristine":{"archive":"seed/pristine.tar","archive_sha256":"artifact:sha256:be14f51d3acd4c702e302d4b40085e6e5bbb12680147df1f069002f8687b1926","commit":"dd99ed2cf39c805d719f943c5d7061a5683d98a8","license":"MIT","origin":"https://github.com/gothinkster/angular-realworld-example-app","tree_sha256":"source-tree:sha256:d6dfce02588be0a7376a25c390087ef56bdad4f4cbbb3913e7dcc69ff2c7373a"},"scenario_baseline":"source-tree:sha256:7485d66f5ef4b0ffdaeebc13ca17d1bd001a3d60dd542d30f1e70de4b1d4d18e","seed_inputs":[{"kind":"git-patch","path":"seed/feature.patch","sha256":"artifact:sha256:9bbf8bd23a9f2f961cebaaec8903d8b7549636b02fcb3602512f83a5f6bfa69d"}]},"scenario_id":"functional-v1/angular-reading-time","schema":{"canonicalization_sha256":"canonicalization:sha256:5f871a41f05d8bab1af662a5c91cce456c05af84c77f602d0572da778ec5f3f9","canonicalization_version":1,"name":"model-benchmark/scenario-lock","sha256":"schema:sha256:73f848d0474eaa16b58fe0be10c8d44fa658a24767bf20ce4f42b151ec127896","version":1},"standard_v1":{"id":"standard-v1","sha256":"execution-profile:sha256:3c8c18d9509ad733fd79ba6c98b3350571767c1b9b5817f3302804727f2d5c22"}}